id,code,site,descricao,marca,modelo,tamanho,entrada,socket
207,KB-MB-207,Kabum,"Placa-mãe MSI MEG X570 Godlike, AMD AM4, E-ATX, DDR4",MSI,MEG X570 Godlike,EATX,DDR4,AM4
208,KB-MB-208,Kabum,"Placa-Mãe MSI B365M Pro-VH, Intel LGA 1151, mATX",MSI,B365M Pro-VH,mATX,NaN,LGA 1151
209,KB-MB-209,Kabum,"Placa-Mãe MSI MPG B550 Gaming Edge WiFi, AMD AM4, ATX",MSI,MPG B550 Gaming Edge WiFi, ATX,NaN,AM4
210,KB-MB-210,Kabum,"Placa-Mãe MSI H310M Pro-M2 Plus p/ Intel LGA 1151, m-ATX, DDR4",MSI,H310M Pro-M2 Plus,mATX,DDR4,LGA 1151
211,KB-MB-211,Kabum,"Placa-Mãe MSI MAG B550M Bazooka, AMD AM4, mATX",MSI,MAG B550M Bazooka,mATX,NaN,AM4
212,KB-MB-212,Kabum,"Placa-mãe MSI MEG Z490 GODLIKE, Intel LGA 1200, eATX, DDR4",MSI,MEG Z490 GODLIKE,EATX,DDR4,LGA 1200
213,KB-MB-213,Kabum,"Placa-mãe MSI MAG Z490 TOMAHAWK, Intel LGA 1200, ATX, DDR4",MSI,MAG Z490 TOMAHAWK, ATX,DDR4,LGA 1200
214,KB-MB-214,Kabum,"Placa-Mãe MSI MAG B460M Mortar, Intel LGA 1200, mATX",MSI,MAG B460M Mortar,mATX,NaN,LGA 1200
215,KB-MB-215,Kabum,"Placa-Mãe MSI B460M-A Pro, Intel LGA 1200, mATX",MSI,B460M-A Pro,mATX,NaN,LGA 1200
216,KB-MB-216,Kabum,"Placa-mãe MSI MEG X570 Ace, AMD AM4, ATX, DDR4",MSI,MEG X570 Ace, ATX,DDR4,AM4
217,KB-MB-217,Kabum,"Placa-Mãe MSI MAG B550 Tomahawk, AMD AM4, ATX",MSI,MAG B550 Tomahawk, ATX,NaN,AM4
218,KB-MB-218,Kabum,"Placa-Mãe MSI H310M Pro-VDH Plus p/ Intel LGA 1151, m-ATX, DDR4",MSI,H310M Pro-VDH Plus,mATX,DDR4,LGA 1151
219,KB-MB-219,Kabum,"Placa-Mãe MSI B550M Pro-VDH WiFi, AMD AM4, mATX",MSI,B550M Pro-VDH WiFi,mATX,NaN,AM4
220,KB-MB-220,Kabum,"Placa-mãe MSI MEG Z490 ACE, Intel LGA 1200, ATX, DDR4",MSI,MEG Z490 ACE, ATX,DDR4,LGA 1200
221,KB-MB-221,Kabum,"Placa-mãe MSI MPG Z490 GAMING PLUS, Intel LGA 1200, ATX, DDR4",MSI,MPG Z490 GAMING PLUS, ATX,DDR4,LGA 1200
222,KB-MB-222,Kabum,"Placa-Mãe MSI MAG B460M Bazooka, Intel LGA 1200, mATX",MSI,MAG B460M Bazooka,mATX,NaN,LGA 1200
223,KB-MB-223,Kabum,"Placa-Mãe MSI H410M-PRO Intel LGA 1200, mATX",MSI,H410M-PRO,mATX,NaN,LGA 1200
224,KB-MB-224,Kabum,"Placa-mãe MSI MPG X570 Gaming Plus, AMD AM4, ATX, DDR4",MSI,MPG X570 Gaming Plus, ATX,DDR4,AM4
225,KB-MB-225,Kabum,"Placa-Mãe MSI Z390-A Pro, Intel LGA 1151, ATX, DDR4",MSI,Z390-A Pro, ATX,DDR4,LGA 1151
226,KB-MB-226,Kabum,"Placa-mãe MSI MEG Z490 UNIFY, Intel LGA 1200, ATX, DDR4",MSI,MEG Z490 UNIFY, ATX,DDR4,LGA 1200
227,KB-MB-227,Kabum,"Placa-mãe MSI MPG Z490 GAMING CARBON WIFI, Intel LGA 1200, ATX, DDR4",MSI,MPG Z490 GAMING CARBON WIFI, ATX,DDR4,LGA 1200
228,KB-MB-228,Kabum,"Placa-mãe MSI Z490-A PRO, Intel LGA 1200, ATX, DDR4",MSI,Z490-A PRO, ATX,DDR4,LGA 1200
229,KB-MB-229,Kabum,"Placa-Mãe MSI B460M Pro-VDH WiFi, Intel LGA 1200, mATX",MSI,B460M Pro-VDH WiFi,mATX,NaN,LGA 1200
230,KB-MB-230,Kabum,"Placa-Mãe MSI H410M-A Pro, Intel LGA 1200, mATX",MSI,H410M-A Pro,mATX,NaN,LGA 1200
231,KB-MB-231,Kabum,"Placa-mãe MSI X570-A Pro, AMD AM4, ATX, DDR4",MSI,X570-A Pro, ATX,DDR4,AM4
232,KB-MB-232,Kabum,"Placa-Mãe MSI, Intel LGA-1151, mATX, DDR4 - B365M PRO-VDH",MSI,B365M PRO-VDH,mATX,DDR4,LGA 1151
233,KB-MB-233,Kabum,"Placa-Mãe MSI MAG B550M Mortar WiFi, AMD AM4, mATX",MSI,MAG B550M Mortar WiFi,mATX,NaN,AM4
234,KB-MB-234,Kabum,"Placa-Mãe Gigabyte Aorus Z490 Aorus Elite, Intel LGA 1200, ATX, DDR4",Aorus,Z490 Aorus Elite, ATX,DDR4,LGA 1200
235,KB-MB-235,Kabum,"Placa-Mãe Gigabyte Aorus Z390 Aorus Elite, Intel LGA 1151, ATX, DDR4",Aorus,Z390 Aorus Elite, ATX,DDR4,LGA 1151
236,KB-MB-236,Kabum,"Placa-Mãe Gigabyte Aorus X470 Aorus Ultra Gaming, AMD AM4, ATX, DDR4",Aorus,X470 Aorus Ultra Gaming, ATX,DDR4,AM4
237,KB-MB-237,Kabum,"Placa-Mãe Gigabyte Aorus Z490 Aorus Elite AC, Intel LGA 1200, ATX, DDR4",Aorus,Z490 Aorus Elite AC, ATX,DDR4,LGA 1200
238,KB-MB-238,Kabum,"Placa-Mãe Gigabyte Aorus B360 Aorus Gaming 3, Intel LGA 1151, ATX, DDR4",Aorus,B360 Aorus Gaming 3, ATX,DDR4,LGA 1151
239,KB-MB-239,Kabum,"Placa-Mãe Gigabyte Aorus Z390 Aorus Pro, Intel LGA 1151, ATX, DDR4",Aorus,Z390 Aorus Pro, ATX,DDR4,LGA 1151
240,KB-MB-240,Kabum,"Placa-Mãe Gigabyte B450M Aorus Elite, AMD AM4, Micro ATX, DDR4",Aorus,B450M Aorus Elite,mATX,DDR4,AM4
241,KB-MB-241,Kabum,"Placa-Mãe Gigabyte Aorus Z390 Aorus Pro Wi-Fi, Intel LGA 1151, ATX, DDR4",Aorus,Z390 Aorus Pro Wi-Fi, ATX,DDR4,LGA 1151
242,KB-MB-242,Kabum,"Placa-Mãe Gigabyte Aorus Z390 I Aorus Pro Wi-Fi, Intel LGA 1151, Mini-ITX, DDR4",Aorus,Z390 I Aorus Pro Wi-Fi,Mini ITX,DDR4,LGA 1151
243,KB-MB-243,Kabum,"Placa-Mãe Gigabyte Aorus Z370M Aorus Gaming, Intel LGA 1151, mATX, DDR4",Aorus,Z370M Aorus Gaming,mATX,DDR4,LGA 1151
244,KB-MB-244,Kabum,"Placa-Mãe Gigabyte Aorus H370 Aorus Gaming 3, Intel LGA 1151, ATX, DDR4",Aorus,H370 Aorus Gaming 3, ATX,DDR4,LGA 1151
245,KB-MB-245,Kabum,"Placa-Mãe Gigabyte Aorus Z390 Aorus Ultra, Intel LGA 1151, ATX, DDR4",Aorus,Z390 Aorus Ultra, ATX,DDR4,LGA 1151
246,KB-MB-246,Kabum,"Placa-Mãe ASRock H110M-HG4, Intel LGA 1151, mATX, DDR4",ASRock,H110M-HG4,mATX,DDR4,LGA 1151
247,KB-MB-247,Kabum,"Placa-Mãe ASRock B360M Performance, Intel LGA 1151, mATX, DDR4",ASRock,B360M Performance,mATX,DDR4,LGA 1151
248,KB-MB-248,Kabum,"Placa-mãe Asrock B365M Phantom Gaming 4, Intel LGA 1151, mATX, DDR4",ASRock,B365M Phantom Gaming 4,mATX,DDR4,LGA 1151
249,KB-MB-249,Kabum,"Placa-Mãe ASRock AM1B-MH, AMD AM1, mATX, DDR3",ASRock,AM1B-MH,mATX,DDR3,AM1
250,KB-MB-250,Kabum,"Placa-Mãe ASRock B450 Pro4, AMD AM4, ATX, DDR4",ASRock,B450 Pro4, ATX,DDR4,AM4
251,KB-MB-251,Kabum,"Placa-Mãe ASRock Z270 Killer SLI/BR, Intel LGA 1151, ATX, DDR4",ASRock,Z270 Killer SLI/BR, ATX,DDR4,LGA 1151
252,KB-MB-252,Kabum,"Placa-Mãe ASRock H310M-HG4, Intel LGA 1151, mATX, DDR4",ASRock,H310M-HG4,mATX,DDR4,LGA 1151
253,KB-MB-253,Kabum,"Placa-Mãe ASRock Z390 Phantom Gaming 7, Intel 1151, ATX, DDR4",ASRock,Z390 Phantom Gaming 7, ATX,DDR4,LGA 1151
254,KB-MB-254,Kabum,"Placa-Mãe ASRock H470 Steel Legend, Intel LGA 1200, ATX, DDR4 - 90-MXBCK0-A0UAYZ",ASRock,H470 Steel Legend - 90-MXBCK0-A0UAYZ, ATX,DDR4,LGA 1200
255,KB-MB-255,Kabum,"Placa-Mãe ASRock N68-GS4 FX R2.0, AMD AM3+, mATX, DDR3",ASRock,N68-GS4 FX R2.0 +,mATX,DDR3,AM3
256,KB-MB-256,Kabum,"Placa-Mãe ASRock TRX40 Taichi, AMD sTRX4, ATX, DDR4",ASRock,Taichi AMD sTRX4, ATX,DDR4,TRX40
257,KB-MB-257,Kabum,Placa-Mãe ASRock p/ Intel LGA 1151 ATX Fatal1ty Z270 Professional Gaming i7 DDR4,ASRock,Fatal1ty Z270 Professional Gaming i7, ATX,DDR4,LGA 1151
258,KB-MB-258,Kabum,"Placa-Mãe ASRock B365M-HDV, Intel LGA 1151, mATX, DDR4 - 90-MXB9R0-A0UAYZ",ASRock,B365M-HDV - 90-MXB9R0-A0UAYZ,mATX,DDR4,LGA 1151
259,KB-MB-259,Kabum,"Placa-Mãe ASRock H470M-ITX/ac, Intel LGA 1200, Mini-ITX, DDR4",ASRock,H470M-ITX/ac,Mini ITX,DDR4,LGA 1200
260,KB-MB-260,Kabum,"Placa-mãe Asrock B450M Pro4-F, AMD AM4, mATX, DDR4",ASRock,B450M Pro4-F,mATX,DDR4,AM4
261,KB-MB-261,Kabum,"Placa-Mãe ASRock H370 Pro4, Intel LGA 1151, ATX, DDR4",ASRock,H370 Pro4, ATX,DDR4,LGA 1151
262,KB-MB-262,Kabum,"Placa-Mãe ASRock H310CM-HG4, Intel LGA 1151, mATX, DDR4",ASRock,H310CM-HG4,mATX,DDR4,LGA 1151
263,KB-MB-263,Kabum,"Placa-Mãe ASRock Z490M Pro4, Intel LGA 1200, Micro ATX, DDR4 - 90-MXBBV0-A0UAYZ",ASRock,Z490M Pro4 - 90-MXBBV0-A0UAYZ,mATX,DDR4,LGA 1200
264,KB-MB-264,Kabum,"Placa-Mãe ASRock B450 Gaming K4, AMD AM4, ATX, DDR4",ASRock,B450 Gaming K4, ATX,DDR4,AM4
265,KB-MB-265,Kabum,"Placa-Mãe ASRock X570 Phantom Gaming X, AMD AM4, ATX, DDR4",ASRock,X570 Phantom Gaming X, ATX,DDR4,AM4
266,KB-MB-266,Kabum,"Placa-Mãe ASRock X570 Phantom Gaming ITX/TB3, AMD AM4, Mini-ITX, DDR4",ASRock,X570 Phantom Gaming ITX/TB3,Mini ITX,DDR4,AM4
267,KB-MB-267,Kabum,"Placa-Mãe Asus TUF Gaming B550M-Plus, AMD AM4, mATX, DDR4",Asus,TUF Gaming B550M-Plus,mATX,DDR4,AM4
268,KB-MB-268,Kabum,"Placa-Mãe Asus TUF Gaming X570-Plus (Wi-Fi), AMD AM4, ATX, DDR4",Asus,TUF Gaming X570-Plus (Wi-Fi), ATX,DDR4,AM4
269,KB-MB-269,Kabum,Placa-Mãe Asus Prime Z490M-Plus + Case para SSD Asus Rog Strix Arion M.2,Asus,Prime Z490M-Plus + Case para SSD Rog Strix Arion M.2,NaN,NaN,NaN
270,KB-MB-270,Kabum,"Placa-Mãe Asus M5A78L-M Plus/USB3, AMD AM3+, mATX, DDR3",Asus,M5A78L-M Plus/USB3 +,mATX,DDR3,AM3
271,KB-MB-271,Kabum,"Placa-Mãe Asus Prime B450M-K, AMD AM4, mATX, DDR4",Asus,Prime B450M-K,mATX,DDR4,AM4
272,KB-MB-272,Kabum,Placa-Mãe ASUS p/ Intel LGA 1150 ATX B85-A R2.0 DDR3,Asus,B85-A R2.0, ATX,DDR3,LGA 1150
273,KB-MB-273,Kabum,"Placa-Mãe Asus Prime B250M-Plus/BR, Intel LGA 1151, mATX, DDR4",Asus,Prime B250M-Plus/BR,mATX,DDR4,LGA 1151
274,KB-MB-274,Kabum,"Placa-Mãe Asus Prime X570-Pro, AMD AM4, ATX, DDR4",Asus,Prime X570-Pro, ATX,DDR4,AM4
275,KB-MB-275,Kabum,"Placa-Mãe Asus ROG Strix Z390-H Gaming, Intel LGA 1151, ATX, DDR4",Asus,ROG Strix Z390-H Gaming, ATX,DDR4,LGA 1151
276,KB-MB-276,Kabum,"Placa-Mãe Asus ROG STRIX X299-E Gaming II, Intel LGA 2066, ATX, DDR4",Asus,ROG STRIX X299-E Gaming II, ATX,DDR4,LGA 2066
277,KB-MB-277,Kabum,"Placa-Mãe Asus PRO WS C422-ACE, Intel LGA 2066, ATX, DDR4",Asus,PRO WS C422-ACE, ATX,DDR4,LGA 2066
278,KB-MB-278,Kabum,"Placa-Mãe Asus Prime A320I-K, AMD AM4, mATX, DDR4",Asus,Prime A320I-K,mATX,DDR4,AM4
279,KB-MB-279,Kabum,"Placa-Mãe Asus H110M-C/BR, Intel LGA 1151, mATX, DDR4",Asus,H110M-C/BR,mATX,DDR4,LGA 1151
280,KB-MB-280,Kabum,"Placa-Mãe Asus Prime H310M-E/BR, Intel LGA 1151, mATX, DDR4",Asus,Prime H310M-E/BR,mATX,DDR4,LGA 1151
281,KB-MB-281,Kabum,"Placa-Mãe Asus TUF B450M-PRO GAMING, AMD AM4, mATX, DDR4",Asus,TUF B450M-PRO GAMING,mATX,DDR4,AM4
282,KB-MB-282,Kabum,"Placa-Mãe Asus TUF Z390-Plus Gaming, Intel LGA 1151, ATX, DDR4",Asus,TUF Z390-Plus Gaming, ATX,DDR4,LGA 1151
283,KB-MB-283,Kabum,"Placa-Mãe Asus M5A78L-M LX/BR, AMD AM3+, mATX, DDR3",Asus,M5A78L-M LX/BR +,mATX,DDR3,AM3
284,KB-MB-284,Kabum,"Placa-Mãe Asus ROG Strix X399-E Gaming, AMD TR4, eATX, DDR4",Asus,ROG Strix X399-E Gaming,EATX,DDR4,TR4
285,KB-MB-285,Kabum,"Placa-Mãe ASUS p/ Intel LGA 1151 Mini ITX B150I PRO GAMING/WIFI/AURA, 2x DDR4, Wifi, Áudio Supreme FX, Gamers Guardian, DVI/HDMI",Asus,B150I PRO GAMING/WIFI/AURA 2x Wifi Áudio Supreme FX Gamers Guardian DVI/HDMI,Mini ITX,DDR4,LGA 1151
286,KB-MB-286,Kabum,"Placa-Mãe Asus ROG Strix X570-F Gaming, AMD AM4, ATX, DDR4",Asus,ROG Strix X570-F Gaming, ATX,DDR4,AM4
287,KB-MB-287,Kabum,"Placa-Mãe Asus ROG Rampage VI Extreme Encore, Intel LGA 2066, E-ATX, DDR4",Asus,ROG Rampage VI Extreme Encore,EATX,DDR4,LGA 2066
288,KB-MB-288,Kabum,"Placa-Mãe Asus AM1M-A/BR, AMD AM1, mATX, DDR3",Asus,AM1M-A/BR,mATX,DDR3,AM1
289,KB-MB-289,Kabum,"Placa-Mãe Asus Prime A320M-A, AMD AM4, mATX, DDR4",Asus,Prime A320M-A,mATX,DDR4,AM4
290,KB-MB-290,Kabum,"Placa-Mãe Asus H110M-CS/BR, Intel LGA 1151, mATX, DDR4",Asus,H110M-CS/BR,mATX,DDR4,LGA 1151
291,KB-MB-291,Kabum,"Placa-Mãe Galax H310M PLUS+, Intel 1151, mATX, DDR4",Galax,H310M PLUS+,mATX,DDR4,LGA 1151
292,KB-MB-292,Kabum,"Placa-Mãe Gigabyte GA-H110M-S2PH, Intel LGA 1151, mATX, DDR4",Gigabyte,GA-H110M-S2PH,mATX,DDR4,LGA 1151
293,KB-MB-293,Kabum,"Placa-Mãe Gigabyte TRX40 Designare, AMD TRX4, XL-ATX, DDR4 (REV 1.0)",Gigabyte,Designare AMD TRX4 (REV 1.0),XL-ATX,DDR4,TRX40
294,KB-MB-294,Kabum,"Placa-Mãe Gigabyte GA-H270M-Gaming 3, Intel LGA 1151, mATX, DDR4",Gigabyte,GA-H270M-Gaming 3,mATX,DDR4,LGA 1151
295,KB-MB-295,Kabum,"Placa-mãe Gigabyte B360 Aorus Gaming 3 Wi-Fi, Intel LGA 1151, ATX, DDR4",Gigabyte,B360 Aorus Gaming 3 Wi-Fi, ATX,DDR4,LGA 1151
296,KB-MB-296,Kabum,"Placa-Mãe Gigabyte B360M Gaming HD, Intel LGA 1151, mATX, DDR4",Gigabyte,B360M Gaming HD,mATX,DDR4,LGA 1151
297,KB-MB-297,Kabum,"Placa-Mãe Gigabyte GA-AX370-Gaming, AMD AM4, ATX, DDR4",Gigabyte,GA-AX370-Gaming, ATX,DDR4,AM4
298,KB-MB-298,Kabum,"Placa-Mãe Gigabyte B360N WiFi, Intel LGA 1151, Mini-ITX, DDR4 (Rev. 1.0)",Gigabyte,B360N WiFi (Rev. 1.0),Mini ITX,DDR4,LGA 1151
299,KB-MB-299,Kabum,Placa mãe GigaByte p/ Intel GA-Z87M-D3H LGA 1150,Gigabyte,GigaByte Intel GA-Z87M-D3H,NaN,NaN,LGA 1150
300,KB-MB-300,Kabum,"Placa Mãe Gigabyte B460M AORUS ELITE, Intel LGA1200, DDR4",Gigabyte,B460M AORUS ELITE,NaN,DDR4,LGA 1200
301,KB-MB-301,Kabum,"Placa-Mãe Gigabyte GA-B150M-D3H, Intel LGA 1151, mATX, DDR4",Gigabyte,GA-B150M-D3H,mATX,DDR4,LGA 1151
302,KB-MB-302,Kabum,"Placa-Mãe Gigabyte GA-H110M-H, Intel LGA 1151, mATX, DDR4",Gigabyte,GA-H110M-H,mATX,DDR4,LGA 1151
303,KB-MB-303,Kabum,"Placa-Mãe Gigabyte Aorus Z490 Aorus Xtreme, Intel LGA 1200, eATX - Z490 AORUS XTREME",Gigabyte,Aorus Z490 Aorus Xtreme - Z490 AORUS XTREME,EATX,NaN,LGA 1200
304,KB-MB-304,Kabum,"Placa-Mãe Gigabyte GA-78LMT-USB3 KaBuM! E-Sports, AMD AM3+, mATX, DDR3",Gigabyte,GA-78LMT-USB3 KaBuM! E-Sports +,mATX,DDR3,AM3
305,KB-MB-305,Kabum,"Placa-Mãe Gigabyte Z390 Gaming SLI, Intel LGA 1151, ATX, DDR4",Gigabyte,Z390 Gaming SLI, ATX,DDR4,LGA 1151
306,KB-MB-306,Kabum,"Placa-Mãe Gigabyte X299 Designare EX, Intel LGA 2066, ATX, DDR4 (Rev. 1.0)",Gigabyte,X299 Designare EX (Rev. 1.0), ATX,DDR4,LGA 2066
307,KB-MB-307,Kabum,"Placa-Mãe Gigabyte H310N 2.0, Intel LGA 1151, Mini-ITX, DDR4",Gigabyte,H310N 2.0,Mini ITX,DDR4,LGA 1151
308,KB-MB-308,Kabum,"Placa-Mãe Gigabyte GA-B85M-D3PH, Intel LGA 1150, mATX, DDR3",Gigabyte,GA-B85M-D3PH,mATX,DDR3,LGA 1150
309,KB-MB-309,Kabum,"Placa-Mãe Gigabyte GA-B150M-Gaming 3, Intel LGA 1151, mATX, DDR4",Gigabyte,GA-B150M-Gaming 3,mATX,DDR4,LGA 1151
310,KB-MB-310,Kabum,"Placa-Mãe Gigabyte GA-H110-D3A, Intel LGA 1151, ATX, DDR4",Gigabyte,GA-H110-D3A, ATX,DDR4,LGA 1151
311,KB-MB-311,Kabum,"Placa-Mãe Gigabyte B360M D3H, Intel LGA 1151, mATX, DDR4",Gigabyte,B360M D3H,mATX,DDR4,LGA 1151
312,KB-MB-312,Kabum,"Placa-Mãe Gigabyte B360M DS3H, Intel LGA 1151, mATX, DDR4",Gigabyte,B360M DS3H,mATX,DDR4,LGA 1151
313,KB-MB-313,Kabum,"Placa-Mãe Gigabyte GA-F2A68HM-S1, AMD FM2+, mATX, DDR3",Gigabyte,GA-F2A68HM-S1 +,mATX,DDR3,FM2
314,KB-MB-314,Kabum,"Placa-Mãe Gigabyte X299 UD4 Pro, Intel LGA 2066, ATX, DDR4 (Rev. 1.0)",Gigabyte,X299 UD4 Pro (Rev. 1.0), ATX,DDR4,LGA 2066
315,KB-MB-315,Kabum,"Placa-Mãe GIGABYTE p/ Intel LGA 1151 ATX GA-Z170X-GAMING 7,DDR4",Gigabyte,GA-Z170X-GAMING 7, ATX,DDR4,LGA 1151
316,KB-MB-316,Kabum,"Placa-Mãe Gigabyte H310M D3H 2.0 p/ Intel LGA 1151, Micro ATX, DDR4",Gigabyte,H310M D3H 2.0,mATX,DDR4,LGA 1151
317,KB-MB-317,Kabum,"Placa-Mãe Gigabyte GA-H110M-Gaming 3, Intel LGA 1151, mATX, DDR4",Gigabyte,GA-H110M-Gaming 3,mATX,DDR4,LGA 1151
318,KB-MB-318,Kabum,"Placa-Mãe Gigabyte GA-AB350M-Gaming 3, AMD AM4, mATX, DDR4",Gigabyte,GA-AB350M-Gaming 3,mATX,DDR4,AM4
319,KB-MB-319,Kabum,"Placa-Mãe Gigabyte GA-78LMT-USB3 R2, AMD AM3+, mATX, DDR3",Gigabyte,GA-78LMT-USB3 R2 +,mATX,DDR3,AM3
320,KB-MB-320,Kabum,"Placa-Mãe Gigabyte H310M H 2.0, Intel LGA 1151, mATX, DDR4 (Rev. 1.0)",Gigabyte,H310M H 2.0 (Rev. 1.0),mATX,DDR4,LGA 1151
321,KB-MB-321,Kabum,"Placa-Mãe MSI B250M Gaming Pro, Intel LGA 1151, mATX, DDR4 + Mouse Gamer",MSI,B250M Gaming Pro + Mouse Gamer,mATX,DDR4,LGA 1151
322,KB-MB-322,Kabum,"Placa-Mãe MSI B450 Gaming Plus Max p/ AMD AM4, ATX, DDR4",MSI,B450 Gaming Plus Max, ATX,DDR4,AM4
323,KB-MB-323,Kabum,"Placa-Mãe MSI B360M Bazooka, Intel LGA 1151, mATX, DDR4",MSI,B360M Bazooka,mATX,DDR4,LGA 1151
324,KB-MB-324,Kabum,"Placa-Mãe MSI H110M Pro-VH Plus, Intel LGA 1151, mATX, DDR4",MSI,H110M Pro-VH Plus,mATX,DDR4,LGA 1151
325,KB-MB-325,Kabum,"Placa-Mãe MSI B450M Pro-VDH Max p/ AMD AM4, m-ATX, DDR4",MSI,B450M Pro-VDH Max,mATX,DDR4,AM4
326,KB-MB-326,Kabum,"Placa-Mãe MSI MEG Z390 Ace, Intel LGA 1151, ATX, DDR4",MSI,MEG Z390 Ace, ATX,DDR4,LGA 1151
327,KB-MB-327,Kabum,"Placa-Mãe MSI B360M Pro-VH, Intel LGA 1151, mATX, DDR4",MSI,B360M Pro-VH,mATX,DDR4,LGA 1151
328,KB-MB-328,Kabum,"Placa-Mãe MSI A320M-A Pro Max p/ AMD AM4, m-ATX, DDR4",MSI,A320M-A Pro Max,mATX,DDR4,AM4
329,KB-MB-329,Kabum,"Placa-Mãe MSI MPG B550 Gaming Plus, AMD AM4, ATX",MSI,MPG B550 Gaming Plus, ATX,NaN,AM4
330,KB-MB-330,Kabum,"Placa-Mãe MSI H110M Gaming, Intel LGA 1151, mATX, DDR4",MSI,H110M Gaming,mATX,DDR4,LGA 1151
331,KB-MB-331,Kabum,"Placa-Mãe MSI B360M Gaming Plus, Intel LGA 1151, mATX, DDR4",MSI,B360M Gaming Plus,mATX,DDR4,LGA 1151
332,KB-MB-332,Kabum,"Placa-Mãe MSI B450 Tomahawk Max, AMD AM4, ATX, DDR4",MSI,B450 Tomahawk Max, ATX,DDR4,AM4
333,KB-MB-333,Kabum,Placa-Mãe MSI p/ AMD TR4 ATX X399 SLI PLUS DDR4,MSI,X399 SLI PLUS, ATX,DDR4,TR4
335,KB-MB-335,Kabum,"Placa-Mãe ASRock B550M Pro4, AMD AM4, Micro ATX, DDR4",ASRock,B550M Pro4,mATX,DDR4,AM4
336,KB-MB-336,Kabum,"Placa-Mãe Asus Prime Z490M-Plus, Intel LGA 1200, mATX, DDR4",Asus,Prime Z490M-Plus,mATX,DDR4,LGA 1200
337,KB-MB-337,Kabum,"Placa-Mãe Asus TUF Gaming B460-PRO (Wi-Fi), Intel LGA 1200, ATX, DDR4",Asus,TUF Gaming B460-PRO (Wi-Fi), ATX,DDR4,LGA 1200
338,KB-MB-338,Kabum,"Placa-Mãe Asus ROG Strix B550-E Gaming, AMD AM4, ATX, DDR4",Asus,ROG Strix B550-E Gaming, ATX,DDR4,AM4
339,KB-MB-339,Kabum,"Placa-Mãe Asus TUF Gaming B550M-Plus (Wi-Fi), AMD AM4, mATX, DDR4",Asus,TUF Gaming B550M-Plus (Wi-Fi),mATX,DDR4,AM4
340,KB-MB-340,Kabum,"Placa-Mãe Asus Prime A520M-A, AMD AM4, mATX, DDR4",Asus,Prime A520M-A,mATX,DDR4,AM4
341,KB-MB-341,Kabum,"Placa-Mãe Asus ROG Zenith II Extreme Alpha, AMD TRX40, E-ATX, DDR4, ARGB",Asus,ROG Zenith II Extreme Alpha ARGB,EATX,DDR4,TRX40
342,KB-MB-342,Kabum,"Placa-Mãe Gigabyte H310M DS2, Intel LGA 1151, mATX, DDR4",Gigabyte,H310M DS2,mATX,DDR4,LGA 1151
343,KB-MB-343,Kabum,"Placa-Mãe Gigabyte GA-H110M-S2H, Intel LGA1151, Micro ATX, DDR3",Gigabyte,GA-H110M-S2H,mATX,DDR3,LGA 1151
344,KB-MB-344,Kabum,"Placa-Mãe Gigabyte B365M Gaming HD, Intel LGA 1151, mATX, DDR4",Gigabyte,B365M Gaming HD,mATX,DDR4,LGA 1151
345,KB-MB-345,Kabum,"Placa Mãe Mini-Itx Ipx40050g Pro Processador J4005 2.0Ghz Integrado Ddr4 Sodimm, 2Xusb 3.0 2Xusb 2.0 Placa Mãe Mini-Itx Ipx40050g Pro Processador J4005 2.0Ghz Integrado Ddr4 Sodimm. 2Xusb 3.0 2Xusb 2.0",N/D,Mini-Itx Ipx40050g Pro Processador J4005 2.0Ghz Integrado Sodimm 2Xusb 3.0 2Xusb 2.0 Mini-Itx Ipx40050g Pro Processador J4005 2.0Ghz Integrado Sodimm. 2Xusb 3.0 2Xusb 2.0,NaN,Ddr4,NaN
346,KB-MB-346,Kabum,Placa Mãe Pcware Ipmb360 Pro Gaming 4Xddr4/1Xpciex16/4Xsata3/1Xhdmi/1Xvga/4Xusb3.0 Lga 1151 - Pcware,N/D,Pcware Ipmb360 Pro Gaming 4X/1Xpciex16/4Xsata3/1Xhdmi/1Xvga/4Xusb3.0 - Pcware,NaN,ddr4,LGA 1151
347,KB-MB-347,Kabum,"Placa-Mãe Gigabyte Aorus B450 Elite V2, AMD B450, ATX, DDR4, (rev. 1.0)",Aorus,B450 Elite V2 AMD B450 (rev. 1.0), ATX,DDR4,NaN
348,KB-MB-348,Kabum,"Placa-Mãe Asus Prime Z390-A, Intel LGA 1151, ATX, DDR4",Asus,Prime Z390-A, ATX,DDR4,LGA 1151
349,KB-MB-349,Kabum,"Placa-Mãe Gigabyte B450M DS3H, AMD, mATX, DDR4",Gigabyte,B450M DS3H AMD,mATX,DDR4,NaN
350,KB-MB-350,Kabum,"Placa-Mãe Asus para Intel LGA 1151 mATX B150, DDR3 DDR3L e UEFI BIOS com EZ Flash 3, HDMI, DVI-D, DisplayPort, 6x Sata - B150M-C D3/BR",Asus,para B150 L e UEFI BIOS com EZ Flash 3 HDMI DVI-D DisplayPort 6x Sata - B150M-C D3/BR,mATX,DDR3,LGA 1151
351,KB-MB-351,Kabum,"Placa-Mãe ASUS p/ Intel 6/7a Geração, LGA 1151, mATX, B150M-C/BR, 4x DDR4, HDMI/DVI/VGA/DP USB 3.0, Crossfire, 2 header COM, SBA,Chassis Intrusion",Asus,/7a Geração LGA 1151 B150M-C/BR 4x HDMI/DVI/VGA/DP USB 3.0 Crossfire 2 header COM SBAChassis Intrusion,mATX,DDR4,6
352,KB-MB-352,Kabum,"Placa-Mãe MSI B450 Tomahawk, AMD AM4, ATX, DDR4",MSI,B450 Tomahawk, ATX,DDR4,AM4
353,KB-MB-353,Kabum,"Placa-Mãe Gigabyte B450M DS3H V2, AMD B450, mATX, DDR4, (rev. 1.0)",Gigabyte,B450M DS3H V2 AMD B450 (rev. 1.0),mATX,DDR4,NaN
354,KB-MB-354,Kabum,"Placa-Mãe Asus Rog Strix H470-I Gaming, Intel H470, Mini ITX, DDR4",Asus,Rog Strix H470-I Gaming Intel H470,Mini ITX,DDR4,NaN
355,KB-MB-355,Kabum,"Placa-Mãe Asus Prime B460M-K, Intel B460, mATX, DDR4",Asus,Prime B460M-K Intel B460,mATX,DDR4,NaN
356,KB-MB-356,Kabum,"Placa-Mãe Asus Tuf Gaming H470-Pro (Wi-Fi), Intel H470, ATX, DDR4",Asus,Tuf Gaming H470-Pro (Wi-Fi) Intel H470, ATX,DDR4,NaN
357,KB-MB-357,Kabum,"Placa-Mãe Asus Prime B460I-Plus, Intel B460, ITX 6.0, DDR4",Asus,Prime B460I-Plus Intel B460 ITX 6.0,NaN,DDR4,NaN
358,KB-MB-358,Kabum,"Placa-Mãe Asus ROG Strix TRX40-XE Gaming, AMD TRX40, ATX, DDR4",Asus,ROG Strix -XE Gaming AMD, ATX,DDR4,TRX40
359,KB-MB-359,Kabum,"Placa-Mãe Asus Tuf Gaming H470-Pro, Intel H470, ATX, DDR4",Asus,Tuf Gaming H470-Pro Intel H470, ATX,DDR4,NaN
360,KB-MB-360,Kabum,"Placa-Mãe Asus Prime H470-Plus, Intel H470, ATX, DDR4",Asus,Prime H470-Plus Intel H470, ATX,DDR4,NaN
372,KB-MB-372,Kabum,"Placa-Mãe ASRock A320M-HD, AMD AM4, MATX, DDR4",ASRock,A320M-HD,MATX,DDR4,AM4
361,KB-MB-361,Kabum,"Placa-Mãe Asus Prime H470M-Plus, Intel H470, mATX, DDR4 - 90MB1350-M0EAY0",Asus,Prime H470M-Plus Intel H470 - 90MB1350-M0EAY0,mATX,DDR4,NaN
362,KB-MB-362,Kabum,"Placa-Mãe Asus Prime B460M-A, Intel LGA 1200, mATX, DDR4",Asus,Prime B460M-A,mATX,DDR4,LGA 1200
363,KB-MB-363,Kabum,"Placa-Mãe Gigabyte GA-A320MA-M.2, AMD AM4, mATX, DDR4",Gigabyte,GA-A320MA-M.2,mATX,DDR4,AM4
364,KB-MB-364,Kabum,"Placa-Mãe Aorus B550 Pro AX, AMD B550, ATX, DDR4 (rev. 1.0)",Aorus,B550 Pro AX AMD B550 (rev. 1.0), ATX,DDR4,NaN
365,KB-MB-365,Kabum,"Placa-Mãe Aorus B550M Pro-P, AMD B550, Micro ATX, DDR4 (rev. 1.0)",Aorus,B550M Pro-P AMD B550 (rev. 1.0),mATX,DDR4,NaN
366,KB-MB-366,Kabum,"Placa-Mãe Aorus B550 Elite V2, AMD B550, ATX, DDR4 (rev. 1.0)",Aorus,B550 Elite V2 AMD B550 (rev. 1.0), ATX,DDR4,NaN
367,KB-MB-367,Kabum,"Placa-Mãe Aorus B550 Pro V2, AMD B550, ATX, DDR4 (rev. 1.0)",Aorus,B550 Pro V2 AMD B550 (rev. 1.0), ATX,DDR4,NaN
368,KB-MB-368,Kabum,"Placa-Mãe Gigabyte A520I AC, AMD A520, Mini-ITX, DDR4 (rev. 1.x)",Gigabyte,A520I AC AMD A520 (rev. 1.x),Mini ITX,DDR4,NaN
369,KB-MB-369,Kabum,"Placa-Mãe Gigabyte B450M S2H V2, AMD B450, Micro ATX, DDR4 (rev. 1.0)",Gigabyte,B450M S2H V2 AMD B450 (rev. 1.0),mATX,DDR4,NaN
370,KB-MB-370,Kabum,"Placa-Mãe Gigabyte H410M HD3P, Intel LGA1200, mATX, DDR4, (rev. 1.0)",Gigabyte,H410M HD3P (rev. 1.0),mATX,DDR4,LGA 1200
371,KB-MB-371,Kabum,"Placa Mãe PCWare, Intel LGA 1151, DDR4 - IPMH110G",PCWARE,PCWare - IPMH110G,NaN,DDR4,LGA 1151
373,KB-MB-373,Kabum,Placa-Mãe Asus TUF Gaming B450M-Pro II,Asus,TUF Gaming B450M-Pro II,NaN,NaN,NaN
374,KB-MB-374,Kabum,"Placa-Mãe Asus Prime X570-P, AMD, ATX, DDR4",Asus,Prime X570-P AMD, ATX,DDR4,NaN
375,KB-MB-375,Kabum,"Placa-Mãe Asus ROG Strix X570-I Gaming, AMD X570, Mini-ITX, DDR4",Asus,ROG Strix X570-I Gaming AMD X570,Mini ITX,DDR4,NaN
376,KB-MB-376,Kabum,"Placa-Mãe Asus TUF Z390-Plus Gaming Wi-Fi, Intel LGA 1151, ATX, DDR4",Asus,TUF Z390-Plus Gaming Wi-Fi, ATX,DDR4,LGA 1151
377,KB-MB-377,Kabum,Placa-Mãe GIGABYTE p/ AMD AM4 ATX GA-AB350-GAMING 3 DDR4,Gigabyte,GA-AB350-GAMING 3, ATX,DDR4,AM4
378,KB-MB-378,Kabum,"Placa-Mãe ASUS ROG Strix B550-I Gaming, AMD B550, Mini ITX, DDR4 - 90MB14L0-M0EAY0",Asus,ROG Strix B550-I Gaming AMD B550 - 90MB14L0-M0EAY0,Mini ITX,DDR4,NaN
379,KB-MB-379,Kabum,"Placa-Mãe ASUS ROG Strix B550-A Gaming, AMD B550, ATX, DDR4 - 90MB15J0-M0EAY0",Asus,ROG Strix B550-A Gaming AMD B550 - 90MB15J0-M0EAY0, ATX,DDR4,NaN
380,KB-MB-380,Kabum,Placa-Mãe Asus TUF Gaming B450M-Plus II,Asus,TUF Gaming B450M-Plus II,NaN,NaN,NaN
381,KB-MB-381,Kabum,"Placa-Mãe ASUS TUF Gaming B550-PLUS (WI-FI), AMD B550, ATX, DDR4 - 90MB15D0-M0EAY0",Asus,TUF Gaming B550-PLUS (WI-FI) AMD B550 - 90MB15D0-M0EAY0, ATX,DDR4,NaN
382,KB-MB-382,Kabum,"Placa-Mãe Asus PRO WS X570-ACE, AMD AM4, ATX, DDR4",Asus,PRO WS X570-ACE, ATX,DDR4,AM4
383,KB-MB-383,Kabum,Placa-Mãe Asus TUF Gaming B450-PLUS II,Asus,TUF Gaming B450-PLUS II,NaN,NaN,NaN
384,KB-MB-384,Kabum,Placa-Mãe Asus ROG Strix B450-F Gaming II,Asus,ROG Strix B450-F Gaming II,NaN,NaN,NaN
385,KB-MB-385,Kabum,"Placa Mãe Micro ATX Bluecase LGA 1155 Intel H61, DDR3, Até 16GB, HDMI / VGA - BMBH61-D",Bluecase,Bluecase Intel H61 Até 16GB HDMI / VGA - BMBH61-D,mATX,DDR3,LGA 1155
386,KB-MB-386,Kabum,"Placa Mãe Micro ATX AFOX AMD Ryzen AM4 AMD A320 VGA, HDMI, USB 3.0, DDR4 - A320-MA-V2",BRX,AFOX AMD Ryzen AMD A320 VGA HDMI USB 3.0 - A320-MA-V2,mATX,DDR4,AM4
387,KB-MB-387,Kabum,"Placa-Mãe MSI B450M Pro-M2 Max p/ AMD AM4, m-ATX, DDR4",MSI,B450M Pro-M2 Max,mATX,DDR4,AM4
388,KB-MB-388,Kabum,"Placa-Mãe MSI B450 Tomahawk Max II, AMD AM4, ATX, DDR4",MSI,B450 Tomahawk Max II, ATX,DDR4,AM4
389,KB-MB-389,Kabum,"Kit Upgrade TITO: Placa-Mãe Gigabyte B450M + Memória XPG D41 TUF, 8GB, 3000MHz + Processador AMD Ryzen 5 3600 + SSD Adata SU635, 480GB, SATA",TITO Tech,TITO: Placa-Mãe Gigabyte B450M + Memória XPG D41 TUF 8GB 3000MHz + Processador AMD Ryzen 5 3600 + SSD Adata SU635 480GB SATA,NaN,NaN,NaN
390,KB-MB-390,Kabum,"Kit Upgrade TITO: Placa-Mãe Gigabyte B450M + Memória XPG D41 TUF, 8GB, 3000MHz + Processador AMD Ryzen 7 3800X + SSD WD Blue SN550, 1TB, M.2",TITO Tech,TITO: Placa-Mãe Gigabyte B450M + Memória XPG D41 TUF 8GB 3000MHz + Processador AMD Ryzen 7 3800X + SSD WD Blue SN550 1TB M.2,NaN,NaN,NaN
391,KB-MB-391,Kabum,"Kit Upgrade TITO: Placa-Mãe Gigabyte B450M + Memória RAM Crucial Ballistix 8GB DDR4 + Processador AMD Ryzen 3 2200G +SSD HP S700, 120GB, SATA",TITO Tech,TITO: Placa-Mãe Gigabyte B450M + Memória RAM Crucial Ballistix 8GB + Processador AMD Ryzen 3 2200G +SSD HP S700 120GB SATA,NaN,DDR4,NaN
392,KB-MB-392,Kabum,"Placa-Mãe Gigabyte Aorus Z390 Aorus Master, Intel LGA 1151, ATX, DDR4",Aorus,Z390 Aorus Master, ATX,DDR4,LGA 1151
393,KB-MB-393,Kabum,"Placa-Mãe Aorus X470 Aorus Gaming 5 Wi-Fi, AMD AM4, ATX, DDR4",Aorus,X470 Gaming 5 Wi-Fi, ATX,DDR4,AM4
394,KB-MB-394,Kabum,"Placa-Mãe ASRock X470 Master SLI/AC, AMD AM4, ATX, DDR4",ASRock,X470 Master SLI/AC, ATX,DDR4,AM4
395,KB-MB-395,Kabum,"Placa-Mãe ASRock X470 Taichi, AMD AM4, ATX, DDR4",ASRock,X470 Taichi, ATX,DDR4,AM4
396,KB-MB-396,Kabum,"Placa-Mãe ASRock Z390 Taichi, Intel LGA 1151, ATX, DDR4",ASRock,Z390 Taichi, ATX,DDR4,LGA 1151
397,KB-MB-397,Kabum,"Placa-Mãe ASRock X470 Gaming K4, AMD AM4, ATX, DDR4",ASRock,X470 Gaming K4, ATX,DDR4,AM4
398,KB-MB-398,Kabum,"Placa-Mãe Asus TUF Gaming X570-PLUS, AMD AM4, ATX, DDR4",Asus,TUF Gaming X570-PLUS, ATX,DDR4,AM4
399,KB-MB-399,Kabum,"Kit Upgrade TITO: Placa-Mãe Asus Prime B450M Gaming/BR + Processador AMD Ryzen 5 3400G + Memória XPG Spectrix D41, RGB, 16GB (2x8GB), 3200MHz, DDR4, CL16",Asus,TITO: Placa-Mãe Asus Prime B450M Gaming/BR + Processador AMD Ryzen 5 3400G + Memória XPG Spectrix D41 RGB 16GB (2x8GB) 3200MHz CL16,NaN,DDR4,NaN
