id,code,site,descricao,marca,modelo,tamanho,entrada,socket
0,KB-MB-0,Kabum,"Placa-Mãe Gigabyte Aorus B360M Aorus Gaming 3, Intel LGA 1151, mATX, DDR4",Aorus,B360M Aorus Gaming 3,mATX,DDR4,LGA 1151
1,KB-MB-1,Kabum,"Placa-mãe Gigabyte Aorus B450 Aorus M, AMD AM4, mATX, DDR4",Aorus,B450 Aorus M,mATX,DDR4,AM4
2,KB-MB-2,Kabum,"Placa-Mãe Gigabyte H470I Aorus Pro AX, Intel LGA1200, Mini-ITX, DDR4",Aorus,H470I Aorus Pro AX,Mini ITX,DDR4,LGA 1200
3,KB-MB-3,Kabum,"Placa-Mãe Gigabyte Aorus B450 Aorus Pro, AMD AM4, ATX, DDR4",Aorus,B450 Aorus Pro, ATX,DDR4,AM4
4,KB-MB-4,Kabum,"Placa-Mãe Gigabyte Aorus B365 M Aorus Elite, Intel LGA 1151, mATX, DDR4",Aorus,B365 M Aorus Elite,mATX,DDR4,LGA 1151
5,KB-MB-5,Kabum,"Placa-mãe Gigabyte Aorus X570 Aorus Elite, AMD AM4, ATX, DDR4",Aorus,X570 Aorus Elite, ATX,DDR4,AM4
6,KB-MB-6,Kabum,"Placa-Mãe Gigabyte Aorus X570 Aorus Pro, AM4, ATX, DDR4",Aorus,X570 Aorus Pro, ATX,DDR4,AM4
7,KB-MB-7,Kabum,"Placa-Mãe Gigabyte Aorus Z490 Aorus Master, Intel LGA 1200, ATX, DDR4",Aorus,Z490 Aorus Master, ATX,DDR4,LGA 1200
8,KB-MB-8,Kabum,"Placa-Mãe Gigabyte B550 Aorus Pro AC, AMD AM4, ATX, DDR4",Aorus,B550 Aorus Pro AC, ATX,DDR4,AM4
9,KB-MB-9,Kabum,"Placa-Mãe Gigabyte Z490 UD AC, Intel LGA 1200, ATX, DDR4",Aorus,Z490 UD AC, ATX,DDR4,LGA 1200
10,KB-MB-10,Kabum,"Placa-Mãe Gigabyte H470 Aorus Pro AX, Intel LGA1200, ATX, DDR4",Aorus,H470 Aorus Pro AX, ATX,DDR4,LGA 1200
11,KB-MB-11,Kabum,"Placa-Mãe Gigabyte Aorus B450 Aorus Pro Wi-Fi, AMD AM4, ATX, DDR4",Aorus,B450 Aorus Pro Wi-Fi, ATX,DDR4,AM4
12,KB-MB-12,Kabum,"Placa-Mãe Gigabyte B460 Aorus Pro AC, Intel LGA1200, ATX, DDR4",Aorus,B460 Aorus Pro AC, ATX,DDR4,LGA 1200
13,KB-MB-13,Kabum,"Placa-Mãe Gigabyte Aorus B450 Aorus Elite, AMD ATX, DDR4",Aorus,B450 Aorus Elite AMD, ATX,DDR4,NaN
14,KB-MB-14,Kabum,"Placa-mãe Gigabyte Aorus X570 Aorus Pro WiFi, AMD AM4, ATX, DDR4, Rev 1.0",Aorus,X570 Aorus Pro WiFi Rev 1.0, ATX,DDR4,AM4
15,KB-MB-15,Kabum,"Placa-Mãe Gigabyte Aorus B450 I Aorus Pro Wi-Fi, AM4, Mini-ITX, DDR4",Aorus,B450 I Aorus Pro Wi-Fi,Mini ITX,DDR4,AM4
16,KB-MB-16,Kabum,"Placa-Mãe Gigabyte Aorus X570 Aorus Xtreme, AM4, eATX, DDR4",Aorus,X570 Aorus Xtreme,EATX,DDR4,AM4
17,KB-MB-17,Kabum,"Placa-Mãe Gigabyte Aorus Z490 Aorus Ultra (rev 1.0), Intel LGA 1200, ATX, DDR4",Aorus,Z490 Aorus Ultra (rev 1.0), ATX,DDR4,LGA 1200
18,KB-MB-18,Kabum,"Placa-Mãe Gigabyte B550M Aorus Pro, AMD AM4, Micro ATX, DDR4",Aorus,B550M Aorus Pro,mATX,DDR4,AM4
19,KB-MB-19,Kabum,"Placa-Mãe Gigabyte B550M Aorus Elite, AMD AM4, Micro ATX, DDR4",Aorus,B550M Aorus Elite,mATX,DDR4,AM4
20,KB-MB-20,Kabum,"Placa-Mãe Gigabyte Aorus X399 Aorus Pro, AMD TR4, ATX, DDR4 (Rev. 1.0)",Aorus,X399 Aorus Pro (Rev. 1.0), ATX,DDR4,TR4
21,KB-MB-21,Kabum,"Placa mãe Gigabyte Aorus X570 Aorus Master, AMD AM4, ATX, DDR4",Aorus,Gigabyte Aorus X570 Aorus Master, ATX,DDR4,AM4
22,KB-MB-22,Kabum,"Placa-mãe Gigabyte Aorus X570 I Aorus Pro WiFi, AMD AM4, Mini-ITX, DDR4",Aorus,X570 I Aorus Pro WiFi,Mini ITX,DDR4,AM4
23,KB-MB-23,Kabum,"Placa-Mãe Gigabyte B550I Aorus Pro AX, AMD AM4, Mini-ITX, DDR4",Aorus,B550I Aorus Pro AX,Mini ITX,DDR4,AM4
24,KB-MB-24,Kabum,"Placa-Mãe Aorus B460M Aorus Pro, Intel LGA 1200, mATX, DDR4",Aorus,B460M Pro,mATX,DDR4,LGA 1200
25,KB-MB-25,Kabum,"Placa Mãe Gigabyte Z490 AORUS XTREME Waterforce, Intel LGA1200, E-ATX, DDR4, RGB, Wi-Fi, Bluetooth",Aorus,Gigabyte Z490 AORUS XTREME Waterforce RGB Wi-Fi Bluetooth,EATX,DDR4,LGA 1200
26,KB-MB-26,Kabum,"Placa-Mãe Gigabyte A520 AORUS ELITE, AMD AM4, ATX, DDR4",Aorus,A520 AORUS ELITE, ATX,DDR4,AM4
27,KB-MB-27,Kabum,"Placa-mãe Gigabyte Aorus X570 Aorus Ultra, AMD AM4, ATX, DDR4",Aorus,X570 Aorus Ultra, ATX,DDR4,AM4
28,KB-MB-28,Kabum,"Placa-Mãe Gigabyte Aorus X570 Aorus Elite Wifi, AM4, ATX, DDR4",Aorus,X570 Aorus Elite Wifi, ATX,DDR4,AM4
29,KB-MB-29,Kabum,"Placa-Mãe Gigabyte Aorus Z490I Aorus Ultra, Intel LGA 1200, mini-ITX, DDR4",Aorus,Z490I Aorus Ultra,Mini ITX,DDR4,LGA 1200
30,KB-MB-30,Kabum,"Placa-Mãe Gigabyte B550 Aorus Master, AMD AM4, ATX, DDR4",Aorus,B550 Aorus Master, ATX,DDR4,AM4
31,KB-MB-31,Kabum,"Placa-Mãe Gigabyte Aorus Z490 Aorus PRO AX, Intel LGA 1200, ATX, DDR4",Aorus,Z490 Aorus PRO AX, ATX,DDR4,LGA 1200
32,KB-MB-32,Kabum,"Placa-Mãe Gigabyte B550 Aorus Elite, AMD AM4, ATX, DDR4",Aorus,B550 Aorus Elite, ATX,DDR4,AM4
33,KB-MB-33,Kabum,"Placa-Mãe ASRock B460M-HDV, Intel LGA 1200, Micro ATX, DDR4",ASRock,B460M-HDV,mATX,DDR4,LGA 1200
34,KB-MB-34,Kabum,"Placa-Mãe Asrock ASRock X570 Steel Legend, AMD AM4, ATX, DDR4",ASRock,X570 Steel Legend, ATX,DDR4,AM4
35,KB-MB-35,Kabum,"Placa-Mãe ASRock Z490 Pro4, Intel LGA1200, ATX, DDR4",ASRock,Z490 Pro4, ATX,DDR4,LGA 1200
36,KB-MB-36,Kabum,"Placa-Mãe ASRock X570 Extreme4, AMD AM4, ATX, DDR4",ASRock,X570 Extreme4, ATX,DDR4,AM4
37,KB-MB-37,Kabum,"Placa-Mãe ASRock B450M-HDV R4.0, AMD AM4, Micro ATX, DDR4",ASRock,B450M-HDV R4.0,mATX,DDR4,AM4
38,KB-MB-38,Kabum,"Placa-Mãe ASRock B550M Steel Legend, AMD AM4, Micro ATX, DDR4",ASRock,B550M Steel Legend,mATX,DDR4,AM4
39,KB-MB-39,Kabum,Placa-Mãe ASRock A520M-HVS - 90-MXBE60-A0UAYZ,ASRock,A520M-HVS - 90-MXBE60-A0UAYZ,NaN,NaN,NaN
40,KB-MB-40,Kabum,"Placa-Mãe ASRock Z490 PG Velocita, Intel LGA 1200, ATX, DDR4",ASRock,Z490 PG Velocita, ATX,DDR4,LGA 1200
41,KB-MB-41,Kabum,"Placa-Mãe ASRock Z490M-ITX/ac, Intel LGA 1200, Mini-ITX, DDR4 - 90-MXBC00-A0UAYZ",ASRock,Z490M-ITX/ac - 90-MXBC00-A0UAYZ,Mini ITX,DDR4,LGA 1200
42,KB-MB-42,Kabum,"Placa-Mãe ASRock H470 Phantom Gaming 4, Intel LGA 1200, ATX, DDR4",ASRock,H470 Phantom Gaming 4, ATX,DDR4,LGA 1200
43,KB-MB-43,Kabum,"Placa-Mãe ASRock B450M Steel Legend, AMD AM4, mATX, DDR4 - 90-MXB9Y0-A0BAYZ",ASRock,B450M Steel Legend - 90-MXB9Y0-A0BAYZ,mATX,DDR4,AM4
44,KB-MB-44,Kabum,"Placa-Mãe ASRock H410M-HDV, Intel LGA 1200, Micro ATX, DDR4",ASRock,H410M-HDV,mATX,DDR4,LGA 1200
45,KB-MB-45,Kabum,Placa-Mãe ASRock X570M Pro4,ASRock,X570M Pro4,NaN,NaN,NaN
46,KB-MB-46,Kabum,"Placa-Mãe ASRock B460 Steel Legend, Intel LGA1200, ATX, DDR4",ASRock,B460 Steel Legend, ATX,DDR4,LGA 1200
47,KB-MB-47,Kabum,"Placa-Mãe ASRock B550 Taichi, AMD AM4, ATX, DDR4",ASRock,B550 Taichi, ATX,DDR4,AM4
48,KB-MB-48,Kabum,"Placa-Mãe ASRock A320M-HDV R4.0, AMD AM4, Micro ATX, DDR4",ASRock,A320M-HDV R4.0,mATX,DDR4,AM4
49,KB-MB-49,Kabum,Placa-Mãe ASRock A520M-ITX/ac - 90-MXBDG0-A0UAYZ,ASRock,A520M-ITX/ac - 90-MXBDG0-A0UAYZ,NaN,NaN,NaN
50,KB-MB-50,Kabum,"Placa-Mãe ASRock Z490 Steel Legend, Intel LGA 1200, ATX, DDR4 - 90-MXBC10-A0UAYZ",ASRock,Z490 Steel Legend - 90-MXBC10-A0UAYZ, ATX,DDR4,LGA 1200
334,KB-MB-334,Kabum,"Placa-Mãe ASRock B550 Pro4, AMD AM4, ATX, DDR4",ASRock,B550 Pro4, ATX,DDR4,AM4
51,KB-MB-51,Kabum,"Placa-Mãe ASRock H470M Pro4, Intel LGA 1200, Micro ATX, DDR4",ASRock,H470M Pro4,mATX,DDR4,LGA 1200
52,KB-MB-52,Kabum,"Placa-Mãe ASRock X570 Taichi, AMD AM4, ATX, DDR4",ASRock,X570 Taichi, ATX,DDR4,AM4
53,KB-MB-53,Kabum,"Placa-Mãe ASRock H410M-HVS, Intel LGA 1200, Micro ATX, DDR4",ASRock,H410M-HVS,mATX,DDR4,LGA 1200
54,KB-MB-54,Kabum,"Placa-Mãe ASRock B460M Steel Legend, Intel LGA1200, Micro ATX, DDR4",ASRock,B460M Steel Legend,mATX,DDR4,LGA 1200
55,KB-MB-55,Kabum,"Placa-Mãe ASRock X570 Phantom Gaming 4S, AMD AM4, ATX, DDR4",ASRock,X570 Phantom Gaming 4S, ATX,DDR4,AM4
56,KB-MB-56,Kabum,"Placa-Mãe ASRock B550 PG Velocita, AMD AM4, ATX, DDR4",ASRock,B550 PG Velocita, ATX,DDR4,AM4
57,KB-MB-57,Kabum,"Placa-Mãe ASRock B550M-HDV, AMD AM4, Micro ATX, DDR4",ASRock,B550M-HDV,mATX,DDR4,AM4
58,KB-MB-58,Kabum,Placa-Mãe ASRock A520M-HDVP,ASRock,A520M-HDVP,NaN,NaN,NaN
59,KB-MB-59,Kabum,"Placa-Mãe ASRock B365M Pro4-F, Intel LGA1151, mATX, DDR4",ASRock,B365M Pro4-F,mATX,DDR4,LGA 1151
60,KB-MB-60,Kabum,"Placa-Mãe ASRock Z490 Phantom Gaming 4, Intel LGA 1200, ATX, DDR4 - 90-MXBC60-A0UAYZ",ASRock,Z490 Phantom Gaming 4 - 90-MXBC60-A0UAYZ, ATX,DDR4,LGA 1200
61,KB-MB-61,Kabum,"Placa-Mãe ASRock A320M-HD, AMD AM4, mATX, DDR4",ASRock,A320M-HD,mATX,DDR4,AM4
62,KB-MB-62,Kabum,"Placa-Mãe ASRock B460 Phantom Gaming 4, Intel LGA 1200, ATX, DDR4",ASRock,B460 Phantom Gaming 4, ATX,DDR4,LGA 1200
63,KB-MB-63,Kabum,"Placa-Mãe Asrock X570 PRO4, AMD AM4, ATX, DDR4",ASRock,X570 PRO4, ATX,DDR4,AM4
64,KB-MB-64,Kabum,"Placa-Mãe ASRock H410M-HDV/M.2, Intel LGA 1200, Micro ATX, DDR4",ASRock,H410M-HDV/M.2,mATX,DDR4,LGA 1200
65,KB-MB-65,Kabum,"Placa-Mãe ASRock H310CM-HDV, Intel LGA 1151, Micro ATX, DDR4",ASRock,H310CM-HDV,mATX,DDR4,LGA 1151
66,KB-MB-66,Kabum,"Placa-Mãe ASRock B550 Steel Legend, AMD AM4, ATX, DDR4",ASRock,B550 Steel Legend, ATX,DDR4,AM4
67,KB-MB-67,Kabum,"Placa Mãe ASRock A520M-HDV, AMD AM4, Micro ATX, DDR4 - 90-MXBE50-A0UAYZ",ASRock,A520M-HDV - 90-MXBE50-A0UAYZ,mATX,DDR4,AM4
68,KB-MB-68,Kabum,"Placa-Mãe ASRock Z490 Taichi, Intel LGA 1200, ATX, DDR4",ASRock,Z490 Taichi, ATX,DDR4,LGA 1200
69,KB-MB-69,Kabum,"Placa-Mãe Asus Prime A320M-K/BR, AMD AM4, mATX, DDR4",Asus,Prime A320M-K/BR,mATX,DDR4,AM4
70,KB-MB-70,Kabum,"Placa-Mãe Asus TUF Gaming B460M-Plus, Intel LGA1200, mATX",Asus,TUF Gaming B460M-Plus,mATX,NaN,LGA 1200
71,KB-MB-71,Kabum,"Placa-Mãe Asus TUF Gaming X570-PLUS/BR, AMD AM4, ATX, DDR4",Asus,TUF Gaming X570-PLUS/BR, ATX,DDR4,AM4
72,KB-MB-72,Kabum,"Placa-Mãe Asus TUF B360M-Plus Gaming/BR, Intel LGA 1151, mATX, DDR4",Asus,TUF B360M-Plus Gaming/BR,mATX,DDR4,LGA 1151
73,KB-MB-73,Kabum,"Placa-Mãe Asus Prime B450M Gaming/BR, AMD AM4, mATX, DDR4",Asus,Prime B450M Gaming/BR,mATX,DDR4,AM4
74,KB-MB-74,Kabum,"Placa-Mãe Asus TUF Gaming Z490-Plus, Intel LGA 1200, ATX, DDR4",Asus,TUF Gaming Z490-Plus, ATX,DDR4,LGA 1200
75,KB-MB-75,Kabum,"Placa-Mãe Asus TUF H310M-Plus Gaming/BR, Intel LGA 1151, mATX, DDR4",Asus,TUF H310M-Plus Gaming/BR,mATX,DDR4,LGA 1151
76,KB-MB-76,Kabum,"Placa-Mãe Asus Prime H410M-E, Intel LGA 1200, mATX, DDR4 - 90MB13H0-C1BAY0",Asus,Prime H410M-E - 90MB13H0-C1BAY0,mATX,DDR4,LGA 1200
77,KB-MB-77,Kabum,"Placa-Mãe Asus ROG Maximus XII Extreme, Intel LGA 1200, eATX, DDR4",Asus,ROG Maximus XII Extreme,EATX,DDR4,LGA 1200
78,KB-MB-78,Kabum,"Placa-Mãe Asus EX-A320M-Gaming, AMD AM4, mATX, DDR4",Asus,EX-A320M-Gaming,mATX,DDR4,AM4
79,KB-MB-79,Kabum,"Placa-Mãe Asus ROG Strix Z490-E Gaming, Intel LGA 1200, ATX, DDR4",Asus,ROG Strix Z490-E Gaming, ATX,DDR4,LGA 1200
80,KB-MB-80,Kabum,"Placa-Mãe Asus ROG Strix Z490-G Gaming (Wi-Fi), Intel LGA 1200, mATX, DDR4",Asus,ROG Strix Z490-G Gaming (Wi-Fi),mATX,DDR4,LGA 1200
81,KB-MB-81,Kabum,"Placa-Mãe Asus ROG Crosshair VIII Formula, X570, AMD AM4, ATX, DDR4",Asus,ROG Crosshair VIII Formula X570, ATX,DDR4,AM4
82,KB-MB-82,Kabum,"Placa-mãe Asus ROG STRIX Z490-G GAMING, Intel LGA 1200, mATX, DDR4 - 90MB12Z0-M0EAY0",Asus,ROG STRIX Z490-G GAMING - 90MB12Z0-M0EAY0,mATX,DDR4,LGA 1200
83,KB-MB-83,Kabum,"Placa-Mãe Asus Prime Z390-P, Intel LGA 1151, ATX, DDR4",Asus,Prime Z390-P, ATX,DDR4,LGA 1151
84,KB-MB-84,Kabum,"Placa-Mãe Asus Prime TRX40-PRO, AMD sTRX4, ATX, DDR4",Asus,Prime -PRO AMD sTRX4, ATX,DDR4,TRX40
85,KB-MB-85,Kabum,"Placa-Mãe Asus Prime H310M-E R2.0/BR, Intel LGA 1151, mATX, DDR4",Asus,Prime H310M-E R2.0/BR,mATX,DDR4,LGA 1151
86,KB-MB-86,Kabum,"Placa-Mãe Asus ROG Crosshair VIII Impact, AMD AM4, Mini-DTX, DDR4",Asus,ROG Crosshair VIII Impact Mini-DTX,NaN,DDR4,AM4
87,KB-MB-87,Kabum,"Placa-Mãe Asus Prime X299-Deluxe II, Intel LGA 2066, ATX, DDR4",Asus,Prime X299-Deluxe II, ATX,DDR4,LGA 2066
88,KB-MB-88,Kabum,"Placa-Mãe Asus TUF Gaming B550-Plus, AMD AM4, ATX, DDR4",Asus,TUF Gaming B550-Plus, ATX,DDR4,AM4
89,KB-MB-89,Kabum,"Placa-Mãe Asus Prime Z490-P, Intel LGA 1200, ATX, DDR4",Asus,Prime Z490-P, ATX,DDR4,LGA 1200
90,KB-MB-90,Kabum,"Placa-Mãe Asus Prime B550M-K, AMD AM4, mATX, DDR4",Asus,Prime B550M-K,mATX,DDR4,AM4
91,KB-MB-91,Kabum,"Placa-Mãe Asus Prime H410M-D, Intel LGA 1200, mATX, DDR4",Asus,Prime H410M-D,mATX,DDR4,LGA 1200
92,KB-MB-92,Kabum,"Placa-Mãe Asus TUF Gaming A520M-Plus, AMD AM4, mATX, DDR4",Asus,TUF Gaming A520M-Plus,mATX,DDR4,AM4
93,KB-MB-93,Kabum,"Placa-Mãe Asus ROG Strix B460-F Gaming, Intel LGA 1200, ATX, DDR4",Asus,ROG Strix B460-F Gaming, ATX,DDR4,LGA 1200
94,KB-MB-94,Kabum,"Placa-Mãe Asus Prime A520M-E, AMD AM4, mATX, DDR4",Asus,Prime A520M-E,mATX,DDR4,AM4
95,KB-MB-95,Kabum,"Placa-Mãe Asus ROG Maximus XII Formula, Intel LGA 1200, ATX, DDR4",Asus,ROG Maximus XII Formula, ATX,DDR4,LGA 1200
96,KB-MB-96,Kabum,"Placa-Mãe Asus ROG Strix B450-F Gaming, AMD AM4, ATX, DDR4",Asus,ROG Strix B450-F Gaming, ATX,DDR4,AM4
97,KB-MB-97,Kabum,"Placa-Mãe Asus ROG Strix Z490-I Gaming, Intel LGA 1200, Mini-ITX, DDR4",Asus,ROG Strix Z490-I Gaming,Mini ITX,DDR4,LGA 1200
98,KB-MB-98,Kabum,"Placa-Mãe Asus TUF B450M-Plus Gaming, AMD AM4, mATX, DDR4",Asus,TUF B450M-Plus Gaming,mATX,DDR4,AM4
99,KB-MB-99,Kabum,"Placa-Mãe Asus Prime Z490-A, Intel LGA 1200, ATX, DDR4",Asus,Prime Z490-A, ATX,DDR4,LGA 1200
100,KB-MB-100,Kabum,"Placa-Mãe Asus ROG Strix B460-H Gaming, Intel LGA 1200, ATX, DDR4",Asus,ROG Strix B460-H Gaming, ATX,DDR4,LGA 1200
101,KB-MB-101,Kabum,"Placa-Mãe Asus ROG Crosshair VIII Hero, X570, AMD AM4, ATX, DDR4",Asus,ROG Crosshair VIII Hero X570, ATX,DDR4,AM4
102,KB-MB-102,Kabum,"Placa-mãe Asus PRIME B460-PLUS, Intel LGA 1200, ATX, DDR4 - 90MB13J0-M0EAY0",Asus,PRIME B460-PLUS - 90MB13J0-M0EAY0, ATX,DDR4,LGA 1200
103,KB-MB-103,Kabum,"Placa-Mãe Asus PRIME X299-A II, Intel LGA 2066, ATX, DDR4",Asus,PRIME X299-A II, ATX,DDR4,LGA 2066
104,KB-MB-104,Kabum,"Placa-Mãe Asus ROG Strix B550-F Gaming (Wi-Fi), AMD AM4, ATX, DDR4",Asus,ROG Strix B550-F Gaming (Wi-Fi), ATX,DDR4,AM4
105,KB-MB-105,Kabum,"Placa-Mãe Asus Prime A320M-E, AMD AM4, mATX, DDR4",Asus,Prime A320M-E,mATX,DDR4,AM4
106,KB-MB-106,Kabum,"Placa-Mãe Asus Prime B550M-A (Wi-Fi), AMD AM4, mATX, DDR4",Asus,Prime B550M-A (Wi-Fi),mATX,DDR4,AM4
107,KB-MB-107,Kabum,"Placa-Mãe Asus Prime H410M-A, Intel LGA 1200, mATX, DDR4",Asus,Prime H410M-A,mATX,DDR4,LGA 1200
108,KB-MB-108,Kabum,"Placa-Mãe Asus Prime TRX40-Pro S, AMD TRX40, ATX, DDR4",Asus,Prime -Pro S AMD, ATX,DDR4,TRX40
109,KB-MB-109,Kabum,"Placa-Mãe Asus TUF Gaming B460-Plus, Intel LGA 1200, ATX, DDR4",Asus,TUF Gaming B460-Plus, ATX,DDR4,LGA 1200
110,KB-MB-110,Kabum,"Placa-Mãe Asus Prime A520M-K, AMD AM4, mATX, DDR4",Asus,Prime A520M-K,mATX,DDR4,AM4
111,KB-MB-111,Kabum,"Placa-Mãe Asus ROG Strix B460-G Gaming, Intel LGA 1200, mATX, DDR4",Asus,ROG Strix B460-G Gaming,mATX,DDR4,LGA 1200
112,KB-MB-112,Kabum,"Placa-Mãe Asus ROG Maximus XII Apex, Intel LGA 1200, ATX, DDR4",Asus,ROG Maximus XII Apex, ATX,DDR4,LGA 1200
113,KB-MB-113,Kabum,"Placa-Mãe ASUS p/ AMD AM4 ATX PRIME B450-PLUS, DDR4",Asus,PRIME B450-PLUS, ATX,DDR4,AM4
114,KB-MB-114,Kabum,"Placa-Mãe Asus ROG Strix Z490-F Gaming, Intel LGA 1200, ATX, DDR4 - ROG STRIX Z490-F GAMING",Asus,ROG Strix Z490-F Gaming - ROG STRIX Z490-F GAMING, ATX,DDR4,LGA 1200
115,KB-MB-115,Kabum,"Placa-Mãe Asus TUF B450-Plus Gaming, AMD AM4, ATX, DDR4",Asus,TUF B450-Plus Gaming, ATX,DDR4,AM4
116,KB-MB-116,Kabum,"Placa-Mãe Asus ROG Strix Z490-H Gaming, Intel LGA 1200, ATX, DDR4",Asus,ROG Strix Z490-H Gaming, ATX,DDR4,LGA 1200
117,KB-MB-117,Kabum,"Placa-Mãe Asus ROG Strix X570-E Gaming, AMD AM4, ATX, DDR4",Asus,ROG Strix X570-E Gaming, ATX,DDR4,AM4
118,KB-MB-118,Kabum,"Placa-Mãe Asus TUF Gaming B460M-Plus (Wi-Fi), Intel LGA 1200, mATX, DDR4",Asus,TUF Gaming B460M-Plus (Wi-Fi),mATX,DDR4,LGA 1200
119,KB-MB-119,Kabum,"Placa-Mãe Asus Prime H410I-Plus, Intel LGA 1200, Mini ITX, DDR4",Asus,Prime H410I-Plus,Mini ITX,DDR4,LGA 1200
120,KB-MB-120,Kabum,"Placa-Mãe Asus ROG Zenith Extreme Alpha, AMD TR4, EATX, DDR4",Asus,ROG Zenith Extreme Alpha,EATX,DDR4,TR4
121,KB-MB-121,Kabum,"Placa-Mãe Asus ROG Crosshair VIII Hero (WI-FI), AMD AM4, ATX, DDR4",Asus,ROG Crosshair VIII Hero (WI-FI), ATX,DDR4,AM4
122,KB-MB-122,Kabum,"Placa-Mãe Asus ROG Strix B550-F Gaming, AMD AM4, ATX, DDR4",Asus,ROG Strix B550-F Gaming, ATX,DDR4,AM4
123,KB-MB-123,Kabum,"Placa-Mãe Asus TUF Gaming Z490-Plus (Wi-Fi), Intel LGA 1200, ATX, DDR4",Asus,TUF Gaming Z490-Plus (Wi-Fi), ATX,DDR4,LGA 1200
124,KB-MB-124,Kabum,"Placa-Mãe Asus Prime B550M-A, AMD AM4, mATX, DDR4",Asus,Prime B550M-A,mATX,DDR4,AM4
125,KB-MB-125,Kabum,"Placa-Mãe Asus Prime H410M-K, Intel LGA 1200, mATX, DDR4",Asus,Prime H410M-K,mATX,DDR4,LGA 1200
126,KB-MB-126,Kabum,"Placa-Mãe Asus TUF B450M-Pro S, AMD AM4, mATX, DDR4",Asus,TUF B450M-Pro S,mATX,DDR4,AM4
127,KB-MB-127,Kabum,"Placa-Mãe Asus EX-B460M-V5, Intel LGA 1200, mATX, DDR4",Asus,EX-B460M-V5,mATX,DDR4,LGA 1200
128,KB-MB-128,Kabum,"Placa-Mãe Asus ROG Strix B460-I Gaming, Intel LGA 1200, Mini-ITX, DDR4",Asus,ROG Strix B460-I Gaming,Mini ITX,DDR4,LGA 1200
129,KB-MB-129,Kabum,"Placa-Mãe Asus ROG Maximus XII Hero (Wi-Fi), Intel LGA 1200, ATX, DDR4",Asus,ROG Maximus XII Hero (Wi-Fi), ATX,DDR4,LGA 1200
130,KB-MB-130,Kabum,"Placa-Mãe Asus Prime B450M-A, AMD AM4, mATX, DDR4",Asus,Prime B450M-A,mATX,DDR4,AM4
131,KB-MB-131,Kabum,"Placa-Mãe Asus ROG Strix Z490-A Gaming, Intel LGA 1200, ATX, DDR4",Asus,ROG Strix Z490-A Gaming, ATX,DDR4,LGA 1200
132,KB-MB-132,Kabum,"Placa-Mãe Asus ProART Z490-Creator 10G, Intel LGA 1200, ATX, DDR4",Asus,ProART Z490-Creator 10G, ATX,DDR4,LGA 1200
133,KB-MB-133,Kabum,"Placa-Mãe Asus ROG Zenith II Extreme, AMD sTRX4, EATX, DDR4",Asus,ROG Zenith II Extreme,EATX,DDR4,sTRX4
134,KB-MB-134,Kabum,"Placa-Mãe Asus EX-B365M-V5, Intel LGA 1151, mATX, DDR4",Asus,EX-B365M-V5,mATX,DDR4,LGA 1151
135,KB-MB-135,Kabum,"Placa-Mãe Galax H310M, Intel 1151, mATX, DDR4",Galax,H310M,mATX,DDR4,LGA 1151
136,KB-MB-136,Kabum,"Placa-Mãe Galax B365M, Intel 1151, mATX, DDR4",Galax,B365M,mATX,DDR4,LGA 1151
137,KB-MB-137,Kabum,"Placa-Mãe Gigabyte Z490M Gaming X, Intel LGA 1200, mATX, DDR4",Gigabyte,Z490M Gaming X,mATX,DDR4,LGA 1200
138,KB-MB-138,Kabum,"Placa-Mãe Gigabyte H310M M.2 2.0, Intel LGA 1151, mATX, DDR4",Gigabyte,H310M M.2 2.0,mATX,DDR4,LGA 1151
139,KB-MB-139,Kabum,"Placa-Mãe Gigabyte H310M S2P 2.0, Intel LGA 1151, mATX, DDR4",Gigabyte,H310M S2P 2.0,mATX,DDR4,LGA 1151
140,KB-MB-140,Kabum,"Placa-Mãe Gigabyte GA-A320M-S2H, AMD AM4, mATX, DDR4",Gigabyte,GA-A320M-S2H,mATX,DDR4,AM4
141,KB-MB-141,Kabum,"Placa-Mãe Gigabyte B450 Gaming X, AM4, ATX, DDR4",Gigabyte,B450 Gaming X, ATX,DDR4,AM4
142,KB-MB-142,Kabum,"Placa-Mãe Gigabyte X299X Aorus Xtreme Waterforce p/ Intel LGA 2066, XL-ATX, DDR4",Gigabyte,X299X Aorus Xtreme Waterforce,XL-ATX,DDR4,LGA 2066
143,KB-MB-143,Kabum,"Placa-Mãe Gigabyte TRX40 Aorus Master, AMD TRX40, E-ATX, DDR4 (REV 1.0)",Gigabyte,Aorus Master AMD (REV 1.0),EATX,DDR4,TRX40
144,KB-MB-144,Kabum,"Placa-Mãe Gigabyte B550 Gaming X, AMD AM4, ATX, DDR4",Gigabyte,B550 Gaming X, ATX,DDR4,AM4
145,KB-MB-145,Kabum,"Placa-Mãe Gigabyte Z490M, Intel LGA 1200, mATX, DDR4 - Z490M",Gigabyte,Z490M - Z490M,mATX,DDR4,LGA 1200
146,KB-MB-146,Kabum,"Placa-Mãe Gigabyte B550M Gaming, AMD AM4, Micro ATX, DDR4",Gigabyte,B550M Gaming,mATX,DDR4,AM4
147,KB-MB-147,Kabum,"Placa-Mãe Gigabyte B460M D3H, Intel LGA 1200, mATX, DDR4",Gigabyte,B460M D3H,mATX,DDR4,LGA 1200
148,KB-MB-148,Kabum,"Placa-Mãe Gigabyte Z390 M Gaming, Intel LGA 1151, mATX, DDR4",Gigabyte,Z390 M Gaming,mATX,DDR4,LGA 1151
149,KB-MB-149,Kabum,"Placa-Mãe Gigabyte B450M H, AMD AM4, Micro ATX, DDR4",Gigabyte,B450M H,mATX,DDR4,AM4
150,KB-MB-150,Kabum,"Placa-Mãe Gigabyte H410M H, Intel LGA1200, Micro ATX, DDR4",Gigabyte,H410M H,mATX,DDR4,LGA 1200
151,KB-MB-151,Kabum,"Placa Mãe Gigabyte A520M AORUS ELITE, AMD AM4, DDR4",Gigabyte,A520M AORUS ELITE,NaN,DDR4,AM4
152,KB-MB-152,Kabum,"Placa-Mãe Gigabyte C246M-WU4, Intel LGA 1151, mATX, DDR4",Gigabyte,C246M-WU4,mATX,DDR4,LGA 1151
153,KB-MB-153,Kabum,"Placa-Mãe Gigabyte A520M H, AMD A520, mATX, DDR4, (rev. 1.0)",Gigabyte,A520M H AMD A520 (rev. 1.0),mATX,DDR4,NaN
154,KB-MB-154,Kabum,"Placa-Mãe Gigabyte H410M S2H, Intel LGA1200, Micro ATX, DDR4",Gigabyte,H410M S2H,mATX,DDR4,LGA 1200
155,KB-MB-155,Kabum,"Placa-Mãe Gigabyte B450M Gaming, AMD AM4, mATX, DDR4 (Rev. 1.0)",Gigabyte,B450M Gaming (Rev. 1.0),mATX,DDR4,AM4
156,KB-MB-156,Kabum,"Placa-Mãe Gigabyte W480M VISION W, Intel LGA1200, mATX, DDR4",Gigabyte,W480M VISION W,mATX,DDR4,LGA 1200
157,KB-MB-157,Kabum,"Placa-Mãe Gigabyte H310M S2H 2.0, Intel LGA 1151, mATX, DDR4",Gigabyte,H310M S2H 2.0,mATX,DDR4,LGA 1151
158,KB-MB-158,Kabum,"Placa Mãe Gigabyte B460M POWER, Intel LGA, 1200 DDR4",Gigabyte,B460M POWER,NaN,DDR4,LGA 1200
159,KB-MB-159,Kabum,"Placa-Mãe Gigabyte X299X Designare 10G p/ Intel LGA 2066, E-ATX, DDR4",Gigabyte,X299X Designare 10G,EATX,DDR4,LGA 2066
160,KB-MB-160,Kabum,"Placa-Mãe Gigabyte GA-H110M-S2V, Intel LGA 1151, mATX, DDR4",Gigabyte,GA-H110M-S2V,mATX,DDR4,LGA 1151
161,KB-MB-161,Kabum,"Placa-Mãe Gigabyte TRX40 Aorus Pro Wi-Fi, AMD TRX4, ATX, DDR4 (REV 1.0)",Gigabyte,Aorus Pro Wi-Fi AMD TRX4 (REV 1.0), ATX,DDR4,TRX40
162,KB-MB-162,Kabum,"Placa-Mãe Gigabyte B550 Aorus Pro, AMD AM4, ATX, DDR4",Gigabyte,B550 Aorus Pro, ATX,DDR4,AM4
163,KB-MB-163,Kabum,"Placa-Mãe Gigabyte Z490 UD, Intel LGA 1200, ATX, DDR4",Gigabyte,Z490 UD, ATX,DDR4,LGA 1200
164,KB-MB-164,Kabum,"Placa-Mãe Gigabyte B550M S2H, AMD AM4, Micro ATX, DDR4",Gigabyte,B550M S2H,mATX,DDR4,AM4
165,KB-MB-165,Kabum,"Placa-Mãe Gigabyte B460M DS3H, Intel LGA 1200, mATX, DDR4",Gigabyte,B460M DS3H,mATX,DDR4,LGA 1200
166,KB-MB-166,Kabum,Placa-Mãe GIGABYTE p/ AMD TR4 ATX X399 DESIGNARE EX DDR4,Gigabyte,X399 DESIGNARE EX, ATX,DDR4,TR4
167,KB-MB-167,Kabum,"Placa Mãe Gigabyte A520M S2H, AMD AM4, DDR4",Gigabyte,A520M S2H,NaN,DDR4,AM4
168,KB-MB-168,Kabum,"Placa-Mãe Gigabyte H310M DS2 2.0, Intel LGA 1151, mATX, DDR4",Gigabyte,H310M DS2 2.0,mATX,DDR4,LGA 1151
169,KB-MB-169,Kabum,"Placa-Mãe Gigabyte H410M DS2V, Intel LGA1200, Micro ATX, DDR4",Gigabyte,H410M DS2V,mATX,DDR4,LGA 1200
170,KB-MB-170,Kabum,"Placa-Mãe Gigabyte GA-AB350M-DS3H V2, AMD AM4, mATX, DDR4",Gigabyte,GA-AB350M-DS3H V2,mATX,DDR4,AM4
171,KB-MB-171,Kabum,"Placa-Mãe Gigabyte B365M D3H, Intel LGA 1151, mATX, DDR4",Gigabyte,B365M D3H,mATX,DDR4,LGA 1151
172,KB-MB-172,Kabum,"Placa Mãe Gigabyte W480 VISION D, Intel LGA1200, DDR4",Gigabyte,W480 VISION D,NaN,DDR4,LGA 1200
173,KB-MB-173,Kabum,"Placa Mãe Gigabyte Z490 GAMING X AX, Intel LGA1200, ATX, DDR4",Gigabyte,Z490 GAMING X AX, ATX,DDR4,LGA 1200
174,KB-MB-174,Kabum,"Placa-Mãe Gigabyte B450M S2H, AM4, mATX, DDR4",Gigabyte,B450M S2H,mATX,DDR4,AM4
175,KB-MB-175,Kabum,"Placa-Mãe Gigabyte X299X Aorus Master p/ Intel LGA2066, E-ATX, DDR4",Gigabyte,X299X Aorus Master,EATX,DDR4,LGA 2066
176,KB-MB-176,Kabum,"Placa-Mãe Gigabyte X570 UD, AM4, ATX, DDR4",Gigabyte,X570 UD, ATX,DDR4,AM4
177,KB-MB-177,Kabum,"Placa-Mãe Gigabyte TRX40 Aorus Xtreme, AMD TRX4, XL-ATX, DDR4",Gigabyte,Aorus Xtreme AMD TRX4,XL-ATX,DDR4,TRX40
178,KB-MB-178,Kabum,"Placa-Mãe Gigabyte Z490 Gaming X, Intel LGA 1200, ATX, DDR4",Gigabyte,Z490 Gaming X, ATX,DDR4,LGA 1200
179,KB-MB-179,Kabum,"Placa-Mãe Gigabyte Z490 Vision D, Intel LGA 1200, ATX, DDR4 - Z490 VISION D",Gigabyte,Z490 Vision D - Z490 VISION D, ATX,DDR4,LGA 1200
180,KB-MB-180,Kabum,"Placa-Mãe Gigabyte B460 HD3, Intel LGA 1200, ATX, DDR4",Gigabyte,B460 HD3, ATX,DDR4,LGA 1200
181,KB-MB-181,Kabum,"Placa-Mãe Gigabyte Z390 Gaming X, Intel LGA 1151, ATX, DDR4",Gigabyte,Z390 Gaming X, ATX,DDR4,LGA 1151
182,KB-MB-182,Kabum,"Placa-Mãe Gigabyte B550M H, AMD AM4, Micro ATX, DDR4",Gigabyte,B550M H,mATX,DDR4,AM4
183,KB-MB-183,Kabum,"Placa-Mãe Gigabyte B460M Gaming HD, Intel LGA 1200, mATX, DDR4",Gigabyte,B460M Gaming HD,mATX,DDR4,LGA 1200
184,KB-MB-184,Kabum,"Placa Mãe Gigabyte, GA-E6010N, AMD, DDR3",Gigabyte,Gigabyte GA-E6010N AMD,NaN,DDR3,NaN
185,KB-MB-185,Kabum,"Placa-Mãe Gigabyte H470 HD3, Intel LGA1200, ATX, DDR4",Gigabyte,H470 HD3, ATX,DDR4,LGA 1200
186,KB-MB-186,Kabum,"Placa-Mãe Gigabyte B450M DS3H, AMD AM4, mATX, DDR4",Gigabyte,B450M DS3H,mATX,DDR4,AM4
187,KB-MB-187,Kabum,"Placa Mãe Gigabyte A520M DS3H, AMD AM4, ATX, DDR4",Gigabyte,A520M DS3H, ATX,DDR4,AM4
188,KB-MB-188,Kabum,"Placa-Mãe Gigabyte B460M DS3H AC, Intel LGA1200, Micro ATX, DDR4",Gigabyte,B460M DS3H AC,mATX,DDR4,LGA 1200
189,KB-MB-189,Kabum,"Placa-Mãe Gigabyte H410M S2, Intel LGA1200, Micro ATX, DDR4",Gigabyte,H410M S2,mATX,DDR4,LGA 1200
190,KB-MB-190,Kabum,"Placa-Mãe Gigabyte B365M DS3H, Intel LGA 1151, mATX, DDR4",Gigabyte,B365M DS3H,mATX,DDR4,LGA 1151
191,KB-MB-191,Kabum,"Placa Mãe Gigabyte C621 AORUS XTREME, Intel LGA 3647, DDR4",Gigabyte,C621 AORUS XTREME,NaN,DDR4,LGA 3647
192,KB-MB-192,Kabum,"Placa-Mãe Gigabyte Z390 D, Intel LGA 1151, ATX, DDR4",Gigabyte,Z390 D, ATX,DDR4,LGA 1151
193,KB-MB-193,Kabum,"Placa-Mãe Gigabyte Z490 Vision G, Intel LGA 1200, ATX, DDR4 - Z490 VISION G",Gigabyte,Z490 Vision G - Z490 VISION G, ATX,DDR4,LGA 1200
194,KB-MB-194,Kabum,"Placa-Mãe Gigabyte B550M DS3H, AMD AM4, Micro ATX, DDR4",Gigabyte,B550M DS3H,mATX,DDR4,AM4
195,KB-MB-195,Kabum,"Placa Mãe Gigabyte W480 VISION W, Intel, DDR4",Gigabyte,W480 VISION W Intel,NaN,DDR4,NaN
196,KB-MB-196,Kabum,"Placa-mãe Gigabyte X570 Gaming X, AMD AM4, ATX, DDR4",Gigabyte,X570 Gaming X, ATX,DDR4,AM4
197,KB-MB-197,Kabum,"Placa-Mãe Gigabyte Z390 UD, Intel LGA 1151, ATX, DDR4",Gigabyte,Z390 UD, ATX,DDR4,LGA 1151
198,KB-MB-198,Kabum,"Placa-Mãe Gigabyte B450M DS3H WiFi, AMD AM4, Micro ATX, DDR4",Gigabyte,B450M DS3H WiFi,mATX,DDR4,AM4
199,KB-MB-199,Kabum,"Placa-Mãe Gigabyte H470M DS3H, Intel LGA1200, Micro ATX, DDR4",Gigabyte,H470M DS3H,mATX,DDR4,LGA 1200
200,KB-MB-200,Kabum,"Placa-Mãe Gigabyte Z390 Designare, Intel LGA 1151, ATX, DDR4 (Rev. 1.0)",Gigabyte,Z390 Designare (Rev. 1.0), ATX,DDR4,LGA 1151
201,KB-MB-201,Kabum,"Placa Mãe Gigabyte B550 VISION D, AMD AM4, DDR4",Gigabyte,B550 VISION D,NaN,DDR4,AM4
202,KB-MB-202,Kabum,"Placa-Mãe Gigabyte B460M D2V, Intel LGA1200, Micro ATX, DDR4",Gigabyte,B460M D2V,mATX,DDR4,LGA 1200
203,KB-MB-203,Kabum,"Placa-Mãe Gigabyte GA-A320M-H, AMD AM4, mATX, DDR4 (Rev. 1.1)",Gigabyte,GA-A320M-H (Rev. 1.1),mATX,DDR4,AM4
204,KB-MB-204,Kabum,"Placa-mãe MSI MPG Z490 GAMING EDGE WIFI, Intel LGA 1200, ATX, DDR4",MSI,MPG Z490 GAMING EDGE WIFI, ATX,DDR4,LGA 1200
205,KB-MB-205,Kabum,"Placa-Mãe MSI MAG B460 Tomahawk, Intel LGA 1200, ATX",MSI,MAG B460 Tomahawk, ATX,NaN,LGA 1200
206,KB-MB-206,Kabum,"Placa-Mãe MSI B460M Pro, Intel LGA 1200, mATX",MSI,B460M Pro,mATX,NaN,LGA 1200
